{
  "schema_version": "1.2",
  "product_key": "service-fabric",
  "display_name": "Service Fabric",
  "slug": "service-fabric",
  "page_model": "FlexibleContentPage",
  "capability_status": "supported",
  "catalog_categories": [
    "container"
  ],
  "sources": {
    "zh-cn": {
      "availability": "available",
      "snapshot_path": "pricing/details/service-fabric/index.html",
      "url": "https://www.azure.cn/pricing/details/service-fabric/"
    },
    "en-us": {
      "availability": "available",
      "snapshot_path": "pricing/details/service-fabric/index.html",
      "url": "https://www.azure.cn/en-us/pricing/details/service-fabric/"
    }
  },
  "extraction": {
    "semantic_strategy": "simple_static"
  }
}
